{
  "schema_version": "1.1.0",
  "event_type": "SignalCandidate",
  "event_id": "28282828-2828-4282-8282-282828282821",
  "occurred_at": "2026-07-16T01:31:00.050Z",
  "received_at": "2026-07-16T01:31:00.060Z",
  "correlation_id": "28282828-2828-4282-8282-282828282822",
  "causation_id": "23232323-2323-4232-8232-232323232321",
  "strategy_version": "1.0.0-experimental",
  "symbol": "NEWUSDT",
  "source_sequence": {
    "channel": "strategy-fusion",
    "first": 2001,
    "last": 2001,
    "previous_last": 2000
  },
  "idempotency_key": "signal:2828282828282828282828282828282828282828282828282828282828282828",
  "producer": "realtime-engine",
  "payload": {
    "signal_id": "28282828-2828-4282-8282-282828282823",
    "decision": "NO_TRADE",
    "side": null,
    "setup_type": "NO_SETUP",
    "pa_direction": "NEUTRAL",
    "of_direction": "NEUTRAL",
    "conflict": false,
    "entry_reference": null,
    "structure_stop": null,
    "target_reference": null,
    "edge_horizon_seconds": null,
    "gross_edge_model_hash": null,
    "expected_gross_edge_bps": null,
    "expires_at": "2026-07-16T01:31:01.050Z",
    "reason_codes": ["UNIVERSE_WARMING_UP"]
  }
}
