{
  "schema_version": "1.1.0",
  "event_type": "OrderEvent",
  "event_id": "22222222-2222-4222-8222-222222222221",
  "occurred_at": "2026-07-13T00:15:03.100Z",
  "received_at": "2026-07-13T00:15:03.125Z",
  "correlation_id": "22222222-2222-4222-8222-222222222222",
  "causation_id": "22222222-2222-4222-8222-222222222223",
  "strategy_version": "1.0.0-experimental",
  "symbol": "BTCUSDT",
  "source_sequence": {
    "channel": "binance-user-data",
    "first": 98101,
    "last": 98101,
    "previous_last": 98100
  },
  "idempotency_key": "order-event:42a85c425fc1a2d92fb358071b21b04b2e5e3ac35f594b08f5551cf8267644dd",
  "producer": "execution-service",
  "payload": {
    "account_ref": "acct-prod-01",
    "intent_id": "22222222-2222-4222-8222-222222222224",
    "transport": "STANDARD",
    "client_order_id": "AIQ01BTC000000001",
    "client_algo_id": null,
    "exchange_order_id": "987654321",
    "algo_id": null,
    "algo_status": null,
    "actual_order_id": null,
    "state": "PARTIALLY_FILLED",
    "execution_type": "TRADE_UPDATE",
    "source_event_key": "700000000001",
    "exchange_status": "PARTIALLY_FILLED",
    "exchange_trade_id": "700000000001",
    "exchange_update_time": "2026-07-13T00:15:03.100Z",
    "event_time": "2026-07-13T00:15:03.100Z",
    "original_quantity": "0.01",
    "executed_quantity": "0.004",
    "average_price": "60000.1",
    "last_fill_quantity": "0.004",
    "commission": "0.04800008",
    "commission_asset": "USDT",
    "reduce_only": false,
    "close_position": false,
    "reconciliation_required": false,
    "raw_payload_hash": "ffffffffffffffffffffffffffffffffffffffffffffffffffffffffffffffff",
    "reason_codes": ["EXEC_EXCHANGE_UPDATE_APPLIED"]
  }
}
