{
  "schema_version": "1.1.0",
  "event_type": "OrderEvent",
  "event_id": "23232323-2323-4232-8232-232323232321",
  "occurred_at": "2026-07-13T00:15:03.300Z",
  "received_at": "2026-07-13T00:15:03.325Z",
  "correlation_id": "23232323-2323-4232-8232-232323232322",
  "causation_id": "23232323-2323-4232-8232-232323232323",
  "strategy_version": "1.0.0-experimental",
  "symbol": "BTCUSDT",
  "source_sequence": {
    "channel": "binance-private-algo-update",
    "first": 98201,
    "last": 98201,
    "previous_last": 98200
  },
  "idempotency_key": "order-event:52a85c425fc1a2d92fb358071b21b04b2e5e3ac35f594b08f5551cf8267644ee",
  "producer": "execution-service",
  "payload": {
    "account_ref": "acct-prod-01",
    "intent_id": "23232323-2323-4232-8232-232323232324",
    "transport": "ALGO",
    "client_order_id": null,
    "client_algo_id": "AIQA1BTC000000001",
    "exchange_order_id": null,
    "algo_id": "700000000001",
    "algo_status": "NEW",
    "actual_order_id": null,
    "state": "TRIGGER_PENDING",
    "execution_type": "ALGO_UPDATE",
    "source_event_key": "algo.700000000001.98201",
    "exchange_status": "NEW",
    "exchange_trade_id": null,
    "exchange_update_time": "2026-07-13T00:15:03.300Z",
    "event_time": "2026-07-13T00:15:03.300Z",
    "original_quantity": "0",
    "executed_quantity": "0",
    "average_price": "0",
    "last_fill_quantity": "0",
    "commission": "0",
    "commission_asset": null,
    "reduce_only": false,
    "close_position": true,
    "reconciliation_required": false,
    "raw_payload_hash": "abababababababababababababababababababababababababababababababab",
    "reason_codes": ["EXEC_ALGO_UPDATE_APPLIED"]
  }
}
